{
  "schema_version": "1.0.0",
  "mappings": [
    {
      "mapping_id": "map-001",
      "architecture_node_id": "node-1",
      "diagram_element_id": "elem-1",
      "match_type": "MATCH",
      "confidence": 0.9,
      "evidence": ["name-similarity"]
    }
  ],
  "findings": [
    {
      "finding_id": "f-001",
      "rule_id": "consistency-match",
      "category": "consistency",
      "severity": "INFO",
      "verdict": "PASS",
      "artifact_refs": ["arch-doc", "bpmn-diagram"],
      "target_refs": ["node-1"],
      "evidence": [
        {
          "artifact_id": "arch-doc",
          "locator_type": "LINE",
          "locator": "line-10",
          "excerpt": "Order Management",
          "observation": "Matches diagram element 'Process Order'"
        }
      ],
      "expected": "Architecture node should map to diagram element",
      "actual": "Mapped successfully",
      "recommendation": "No action needed",
      "confidence": 0.95,
      "business_confirmation_required": false,
      "source_rule_refs": [],
      "fingerprint": "def789abc012"
    }
  ],
  "metadata": {
    "mapping_count": 1,
    "match_count": 1
  }
}
